{
  "schemaVersion": "1.0.0",
  "datasetId": "<dataset-id>",
  "csvPath": "<dataset-id>.csv",
  "sourceId": "<source-id>",
  "specimenId": "<specimen-id>",
  "figure": "<exact figure reference in the paper>",
  "axes": {
    "x": { "quantity": "<e.g. vertical displacement beneath the load>", "unit": "mm" },
    "y": { "quantity": "<e.g. applied load>", "unit": "kN" }
  },
  "digitization": {
    "method": "<tool and reading approach>",
    "pointCount": 0,
    "estimatedTolerance": "<mandatory conservative estimate, e.g. +/-3% of axis span>",
    "status": "approximate-digitized",
    "notes": ""
  },
  "provenance": {
    "kind": "approximate-digitized",
    "location": "<paper, figure, and source record file>",
    "sourceAccess": "<how the full text was accessed>"
  }
}
